{
  "authorityChainId": "aut-cisrc-authority-chain-001",
  "rootAuthority": "New Zealand university statutory authority",
  "governanceDomain": "research.data",
  "authorityNodes": [
    {
      "authorityNodeId": "node-001",
      "class": "StatutoryAuthority",
      "object": "New Zealand University Enabling Authority",
      "level": 0,
      "authorityDomain": [
        "university.governance",
        "research.data"
      ],
      "evidenceDocuments": [
        {
          "documentRef": "NZ-UNIVERSITY-AUTHORITY-REF",
          "documentType": "statute",
          "documentTitle": "University enabling authority reference"
        }
      ]
    },
    {
      "authorityNodeId": "node-002",
      "class": "UniversityCouncil",
      "object": "University Board / Council",
      "level": 1,
      "parentNodeId": "node-001",
      "authorityDomain": [
        "university.governance"
      ],
      "evidenceDocuments": [
        {
          "documentRef": "COUNCIL-GOVERNANCE-REF",
          "documentType": "governance_instrument",
          "documentTitle": "University governance instrument"
        }
      ]
    },
    {
      "authorityNodeId": "node-003",
      "class": "ViceChancellor",
      "object": "Vice-Chancellor",
      "level": 2,
      "parentNodeId": "node-002",
      "authorityDomain": [
        "university.operations",
        "research.governance"
      ]
    },
    {
      "authorityNodeId": "node-004",
      "class": "Dean",
      "object": "Faculty Dean",
      "level": 3,
      "parentNodeId": "node-003",
      "authorityDomain": [
        "faculty.governance",
        "research.governance"
      ]
    },
    {
      "authorityNodeId": "node-005",
      "class": "HeadOfSchool",
      "object": "Head of School",
      "level": 4,
      "parentNodeId": "node-004",
      "authorityDomain": [
        "school.governance",
        "research.data"
      ]
    },
    {
      "authorityNodeId": "node-006",
      "class": "Supervisor",
      "object": "Project Supervisor",
      "level": 5,
      "parentNodeId": "node-005",
      "authorityDomain": [
        "research.data",
        "repository.submission",
        "student.supervision"
      ],
      "evidenceDocuments": [
        {
          "documentRef": "PROJECT-SUPERVISOR-APPOINTMENT-001",
          "documentType": "appointment_record",
          "documentTitle": "Project supervisor appointment record"
        }
      ]
    },
    {
      "authorityNodeId": "node-007",
      "class": "ResearchAssistant",
      "object": "Research Assistant",
      "level": 6,
      "parentNodeId": "node-006",
      "authorityDomain": [
        "delegated.research.task"
      ]
    }
  ],
  "evidenceDocuments": [
    {
      "documentRef": "AUT-CISRC-PILOT-MODEL-001",
      "documentType": "pilot_model",
      "documentTitle": "AUT CISRC pilot authority-chain model"
    }
  ]
}
